[
  {
    "link": "/image_card/Clusters_m2.php",
    "thumb": "Images/m2_050907_100.jpg",
    "alt": "M2",
    "title": "Globular Cluster of Aquarius",
    "subtitle": "M2"
  },
  {
    "link": "/image_card/Clusters_m3.php",
    "thumb": "/Images/m3_050503_100.jpg",
    "alt": "M3",
    "title": "Globular Cluster of Canes Venatici",
    "subtitle": "M3"
  },
  {
    "link": "/image_card/Clusters_m4.php",
    "thumb": "/Images/m4_050507_100.jpg",
    "alt": "M4",
    "title": "Globular Cluster of Scorpio",
    "subtitle": "M4"
  },
  {
    "link": "/image_card/Clusters_m5.php",
    "thumb": "/Images/m5_050508_100.jpg",
    "alt": "M5",
    "title": "Globular Cluster of Serpens",
    "subtitle": "M5"
  },
  {
    "link": "/image_card/Clusters_m6.php",
    "thumb": "/Images/m6_050708_100.jpg",
    "alt": "M6",
    "title": "Open Cluster of Scorpius",
    "subtitle": "M6"
  },
  {
    "link": "/image_card/Clusters_m9.php",
    "thumb": "/Images/m9_050603_100.jpg",
    "alt": "M9",
    "title": "Globular Cluster of Ophiuchus",
    "subtitle": "M9"
  },
  {
    "link": "/image_card/Clusters_m10.php",
    "thumb": "/Images/m10_050530_100.jpg",
    "alt": "M10",
    "title": "Globular Cluster of Ophiuchus",
    "subtitle": "M10"
  },
  {
    "link": "/image_card/Clusters_m11.php",
    "thumb": "/Images/m11_050830_100.jpg",
    "alt": "M11",
    "title": "Wild Duck Cluster",
    "subtitle": "M11"
  },
  {
    "link": "/image_card/Clusters_m12.php",
    "thumb": "/Images/m12_050512_100.jpg",
    "alt": "M12",
    "title": "Globular Cluster of Ophiuchus",
    "subtitle": "M12"
  },
  {
    "link": "/image_card/Clusters_m13.php",
    "thumb": "/Images/m13_050414_100.jpg",
    "alt": "M13",
    "title": "Hercules Cluster",
    "subtitle": "M13"
  },
  {
    "link": "/image_card/Clusters_m14.php",
    "thumb": "/Images/m14_050705_100.jpg",
    "alt": "M14",
    "title": "Globular Cluster of Ophiuchus",
    "subtitle": "M14"
  },
  {
    "link": "/image_card/Clusters_m15.php",
    "thumb": "/Images/m15_050710_100.jpg",
    "alt": "M15",
    "title": "Globular Cluster of Pegasus",
    "subtitle": "M15"
  },
  {
    "link": "/image_card/Clusters_m18.php",
    "thumb": "/Images/m18_050905_100.jpg",
    "alt": "M18",
    "title": "Open Cluster of Sagittarius",
    "subtitle": "M18"
  },
  {
    "link": "/image_card/Clusters_m19.php",
    "thumb": "/Images/m19_050409_100.jpg",
    "alt": "M19",
    "title": "Globular Cluster of Ophiuchus",
    "subtitle": "M19"
  },
  {
    "link": "/image_card/Clusters_m22.php",
    "thumb": "/Images/m22_050831_100.jpg",
    "alt": "M22",
    "title": "Globular Cluster of Sagittarius",
    "subtitle": "M22"
  },
  {
    "link": "/image_card/Clusters_m26.php",
    "thumb": "/Images/m26_050901_100.jpg",
    "alt": "M26",
    "title": "Open Cluster of Scutum",
    "subtitle": "M26"
  },
  {
    "link": "/image_card/Clusters_m28.php",
    "thumb": "/Images/m28_050829_100.jpg",
    "alt": "M28",
    "title": "Open Cluster of Sagittarius",
    "subtitle": "M28"
  },
  {
    "link": "/image_card/Clusters_m29.php",
    "thumb": "/Images/m29_041005_100.jpg",
    "alt": "M29",
    "title": "Open Cluster of Cygnus",
    "subtitle": "M29"
  },
  {
    "link": "/image_card/Clusters_m30.php",
    "thumb": "/Images/m30_051030_100.jpg",
    "alt": "M30",
    "title": "Globular Cluster of Capricorn",
    "subtitle": "M30"
  },
  {
    "link": "/image_card/Clusters_m34.php",
    "thumb": "/Images/m34_050906_100.jpg",
    "alt": "M34",
    "title": "Open Cluster of Perseus",
    "subtitle": "M34"
  },
  {
    "link": "/image_card/Clusters_m36.php",
    "thumb": "/Images/m36_040319_24_20m_bgsm_5_25_100.jpg",
    "alt": "M36",
    "title": "Open Cluster of Auriga",
    "subtitle": "M36"
  },
  {
    "link": "/image_card/Clusters_m37.php",
    "thumb": "/Images/m37_041212_100.jpg",
    "alt": "M37",
    "title": "Open Cluster of Auriga",
    "subtitle": "M37"
  },
  {
    "link": "/image_card/Clusters_m38.php",
    "thumb": "/Images/m38_041213_100.jpg",
    "alt": "M38",
    "title": "Open Cluster of Auriga",
    "subtitle": "M38"
  },
  {
    "link": "/image_card/Clusters_m46.php",
    "thumb": "/Images/m46_ngc2438_050203_100.jpg",
    "alt": "M46",
    "title": "Open Cluster of Puppis",
    "subtitle": "M46"
  },
  {
    "link": "/image_card/Clusters_m52.php",
    "thumb": "/Images/m52_050907_100.jpg",
    "alt": "M52",
    "title": "Open Cluster of Cassiopeia",
    "subtitle": "M52"
  },
  {
    "link": "/image_card/Clusters_m53.php",
    "thumb": "/Images/m53_050608_100.jpg",
    "alt": "M53",
    "title": "Globular Cluster of Coma Berenices",
    "subtitle": "M53"
  },
  {
    "link": "/image_card/Clusters_m54.php",
    "thumb": "/Images/m54_050708_100.jpg",
    "alt": "M54",
    "title": "Globular Cluster of Sagittarius",
    "subtitle": "M54"
  },
  {
    "link": "/image_card/Clusters_m56.php",
    "thumb": "/Images/m56_050607_100.jpg",
    "alt": "M56",
    "title": "Globular Cluster of Lyra",
    "subtitle": "M56"
  },
  {
    "link": "/image_card/Clusters_m62.php",
    "thumb": "/Images/m62_050409_100.jpg",
    "alt": "M62",
    "title": "Globular Cluster of Ophiuchus",
    "subtitle": "M62"
  },
  {
    "link": "/image_card/Clusters_m67.php",
    "thumb": "/Images/m67_041209_100.jpg",
    "alt": "M67",
    "title": "Open Cluster of Cancer",
    "subtitle": "M67"
  },
  {
    "link": "/image_card/Clusters_m71.php",
    "thumb": "/Images/m71_050906_100.jpg",
    "alt": "M71",
    "title": "Globular Cluster of Sagitta",
    "subtitle": "M71"
  },
  {
    "link": "/image_card/Clusters_m72.php",
    "thumb": "/Images/m72_Combine_100.jpg",
    "alt": "M72",
    "title": "Globular Cluster of Aquarius",
    "subtitle": "M72"
  },
  {
    "link": "/image_card/Clusters_m75.php",
    "thumb": "/Images/m75_040914_100.jpg",
    "alt": "M75",
    "title": "Globular Cluster of Sagittarius",
    "subtitle": "M75"
  },
  {
    "link": "/image_card/Clusters_m79.php",
    "thumb": "/Images/m79_041211_100.jpg",
    "alt": "M79",
    "title": "Globular Cluster of Lepus",
    "subtitle": "M79"
  },
  {
    "link": "/image_card/Clusters_m80.php",
    "thumb": "/Images/m80_050607_100.jpg",
    "alt": "M80",
    "title": "Globular Cluster of Scorpius",
    "subtitle": "M80"
  },
  {
    "link": "/image_card/Clusters_m92.php",
    "thumb": "/Images/m92_050503_100.jpg",
    "alt": "M92",
    "title": "Globular Cluster of Hercules",
    "subtitle": "M92"
  },
  {
    "link": "/image_card/Clusters_m93.php",
    "thumb": "/Images/m93_040123_03_30m_100.jpg",
    "alt": "M93",
    "title": "Open Cluster of Puppis",
    "subtitle": "M93"
  },
  {
    "link": "/image_card/Clusters_m103.php",
    "thumb": "/Images/m103_041007_100.jpg",
    "alt": "M103",
    "title": "Open Cluster of Cassiopeia",
    "subtitle": "M103"
  },
  {
    "link": "/image_card/Clusters_m107.php",
    "thumb": "/Images/m107_050608_100.jpg",
    "alt": "M107",
    "title": "Globular Cluster of Ophiuchus",
    "subtitle": "M107"
  },
  {
    "link": "/image_card/Clusters_ngc457.php",
    "thumb": "/Images/ngc457_041006_100.jpg",
    "alt": "NGC457",
    "title": "Open Cluster of Cassiopeia",
    "subtitle": "NGC457"
  },
  {
    "link": "/image_card/Clusters_ngc6823.php",
    "thumb": "/Images/ngc6823_041012_100.jpg",
    "alt": "NGC6823",
    "title": "Open Cluster of Vulpecula",
    "subtitle": "NGC6823"
  },
  {
    "link": "/image_card/Clusters_ngc6830.php",
    "thumb": "/Images/ngc6830_040819_100.jpg",
    "alt": "NGC6830",
    "title": "Open Cluster of Vulpecula",
    "subtitle": "NGC6830"
  },
  {
    "link": "/image_card/Clusters_ngc7510.php",
    "thumb": "/Images/ngc7510_040809_100.jpg",
    "alt": "NGC7510",
    "title": "Open Cluster of Cepheus",
    "subtitle": "NGC7510"
  }
]
