[
  {
    "link": "/image_card/178ED_m8.php",
    "thumb": "Images/m8_040620_100.jpg",
    "alt": "Lagoon Nebula",
    "title": "Lagoon Nebula",
    "subtitle": "M8"
  },
  {
    "link": "/image_card/178ED_m16.php",
    "thumb": "Images/m16_040621_100.jpg",
    "alt": "Eagle Nebula",
    "title": "Eagle Nebula",
    "subtitle": "M16"
  },
  {
    "link": "/image_card/178ED_m20.php",
    "thumb": "Images/m20_040621_100.jpg",
    "alt": "Trifid Nebula",
    "title": "Trifid Nebula",
    "subtitle": "M20"
  },
  {
    "link": "/image_card/178ED_m23.php",
    "thumb": "Images/m23R_050701_100.jpg",
    "alt": "NGC 6494",
    "title": "NGC 6494",
    "subtitle": "M23"
  },
  {
    "link": "/image_card/178ED_m24.php",
    "thumb": "Images/m24R_050702_100.jpg",
    "alt": "Sagittarius Star Cloud",
    "title": "Sagittarius Star Cloud",
    "subtitle": "M24"
  },
  {
    "link": "/image_card/178ED_m25.php",
    "thumb": "Images/m25R_050703_100.jpg",
    "alt": "IC 4725",
    "title": "IC 4725",
    "subtitle": "M25"
  },
  {
    "link": "/image_card/178ED_b72.php",
    "thumb": "Images/b72R_050703_100.jpg",
    "alt": "Snake Nebula",
    "title": "Snake Nebula",
    "subtitle": "Barnard 72"
  },
  {
    "link": "/image_card/178ED_m31.php",
    "thumb": "Images/m31_040913_100.jpg",
    "alt": "Andromeda Galaxy",
    "title": "Andromeda Galaxy",
    "subtitle": "M31"
  },
  {
    "link": "/image_card/178ED_m33.php",
    "thumb": "Images/m33_040912_100.jpg",
    "alt": "Pinwheel Galaxy",
    "title": "Pinwheel Galaxy",
    "subtitle": "M33"
  },
  {
    "link": "/image_card/178ED_m35_ngc2158.php",
    "thumb": "Images/m35_ngc2158_040313_06_30m_x17g1_bgsm_5_25_100.jpg",
    "alt": "M35",
    "title": "NGC 2158",
    "subtitle": "M35"
  },
  {
    "link": "/image_card/178ED_m41.php",
    "thumb": "Images/m41_040323_09_23m_bgsm_5_25_100.jpg",
    "alt": "M41",
    "title": "NGC 2287",
    "subtitle": "M41"
  },
  {
    "link": "/image_card/178ED_m42.php",
    "thumb": "Images/m42_040913_100.jpg",
    "alt": "M42",
    "title": "Orion Nebula",
    "subtitle": "M42"
  },
  {
    "link": "/image_card/178ED_trapezium.php",
    "thumb": "Images/Trapezium_040913_100.jpg",
    "alt": "Trapezium",
    "title": "Center of Orion Nebula",
    "subtitle": "Trapezium"
  },
  {
    "link": "/image_card/178ED_m44.php",
    "thumb": "Images/m44_040323_11_30m_bgsm_5_25_100.jpg",
    "alt": "M44",
    "title": "Behive Cluster",
    "subtitle": "M44"
  },
  {
    "link": "/image_card/178ED_m45.php",
    "thumb": "Images/m45R_041116_100.jpg",
    "alt": "M45",
    "title": "Pleiades Star Cluster",
    "subtitle": "M45"
  },
  {
    "link": "/image_card/178ED_m48.php",
    "thumb": "Images/m48_040323_10_30m_bgsm_5_25_100.jpg",
    "alt": "M48",
    "title": "NGC 2548",
    "subtitle": "M48"
  },
  {
    "link": "/image_card/178ED_m65_m66_ngc3628.php",
    "thumb": "Images/m65_m66_ngc3628_040313_09_90m_15_bgsm_2_25_100.jpg",
    "alt": "Leo Triplet",
    "title": "M65, M66 and NGC 2548",
    "subtitle": "Leo Triplet"
  },
  {
    "link": "/image_card/178ED_m81_m82.php",
    "thumb": "Images/m81_m82_040313_07_90m_bgsm_2_25_100.jpg",
    "alt": "M81 and M82",
    "title": "Bode's Galaxy and The Cigar Galaxy",
    "subtitle": "M81 and M82"
  },
  {
    "link": "/image_card/178ED_doublecluster.php",
    "thumb": "Images/DoubleCluster_040917_100.jpg",
    "alt": "NGC 869 and NGC 884",
    "title": "Double Cluster",
    "subtitle": "NGC 869 and NGC 884"
  },
  {
    "link": "/image_card/178ed_ngc2237.php",
    "thumb": "/Images/ngc2237R_041115_100.jpg",
    "alt": "NGC2237",
    "title": "Rosette Nebula",
    "subtitle": "NGC2237"
  },
  {
    "link": "/image_card/178ed_ngc2264.php",
    "thumb": "/Images/ngc2264R_041116_100.jpg",
    "alt": "NGC2264",
    "title": "",
    "subtitle": "NGC2264"
  },
  {
    "link": "/image_card/178ed_ngc5139.php",
    "thumb": "/Images/ngc5139_040313_11_23m_100.jpg",
    "alt": "NGC5139",
    "title": "Omega Centauri",
    "subtitle": "NGC5139"
  },
  {
    "link": "/image_card/178ed_ngc6960.php",
    "thumb": "/Images/ngc6960_040912_100.jpg",
    "alt": "NGC6960",
    "title": "West",
    "subtitle": "NGC6960"
  },
  {
    "link": "/image_card/178ed_ngc6979.php",
    "thumb": "/Images/ngc6979_040917_100.jpg",
    "alt": "NGC6979",
    "title": "Central",
    "subtitle": "NGC6979"
  },
  {
    "link": "/image_card/178ed_ngc6992.php",
    "thumb": "/Images/ngc6992_040913_100.jpg",
    "alt": "NGC6992",
    "title": "East",
    "subtitle": "NGC6992"
  },
  {
    "link": "/image_card/178ed_ngc7000.php",
    "thumb": "/Images/ngc7000_040621_100.jpg",
    "alt": "NGC7000",
    "title": "North America Nebula",
    "subtitle": "NGC7000"
  },
  {
    "link": "/image_card/178ed_ic410.php",
    "thumb": "/Images/ic410_041013_100.jpg",
    "alt": "IC410",
    "title": "Tadpole Nebula",
    "subtitle": "IC410"
  },
  {
    "link": "/image_card/178ed_ic434.php",
    "thumb": "/Images/ic434_041013_100.jpg",
    "alt": "IC434",
    "title": "Horsehead Region",
    "subtitle": "IC434"
  },
  {
    "link": "/image_card/178ed_ic1318.php",
    "thumb": "/Images/ic1318R_050701_100.jpg",
    "alt": "IC1318",
    "title": "Gamma Cygni Nebula",
    "subtitle": "IC1318"
  },
  {
    "link": "/image_card/178ed_ic1396.php",
    "thumb": "/Images/ic1396_040917_100.jpg",
    "alt": "IC1396",
    "title": "Elephant's Trunk Nebula",
    "subtitle": "IC1396"
  },
  {
    "link": "/image_card/178ed_mel15.php",
    "thumb": "/Images/mel15_040917_100.jpg",
    "alt": "IC1805",
    "title": "Heart Nebula",
    "subtitle": "IC1805"
  },
  {
    "link": "/image_card/178ed_ic1848.php",
    "thumb": "/Images/ic1848_041013_100.jpg",
    "alt": "IC1848",
    "title": "Soul Nebula",
    "subtitle": "IC1848"
  },
  {
    "link": "/image_card/178ed_ic5067.php",
    "thumb": "/Images/ic5067_041013_100.jpg",
    "alt": "IC5067",
    "title": "Pelican Nebula",
    "subtitle": "IC5067"
  },
  {
    "link": "/image_card/178ed_ic5146.php",
    "thumb": "/Images/ic5146R_050702_100.jpg",
    "alt": "IC5146",
    "title": "Cocoon Nebula",
    "subtitle": "IC5146"
  },
  {
    "link": "/image_card/178ed_lynds118.php",
    "thumb": "/Images/Lynds118_040912_100.jpg",
    "alt": "LYNDS 118.51",
    "title": "Berkeley 59",
    "subtitle": "LYNDS 118.51"
  },
  {
    "link": "/image_card/178ed_ngc6888.php",
    "thumb": "/Images/ngc6888R_050703_100.jpg",
    "alt": "NGC6888",
    "title": "Crescent Nebula",
    "subtitle": "NGC6888"
  }
]
