[
  {
    "link": "/image_card/SolarSystem_Moon_Full.php",
    "thumb": "Images/FullMoon_200.jpg",
    "alt": "Full Moon",
    "title": "",
    "subtitle": "Full Moon"
  },
  {
    "link": "/image_card/SolarSystem_Moon_3rdQuarter.php",
    "thumb": "Images/moon_040905_200.jpg",
    "alt": "3rd Quarter Moon",
    "title": "",
    "subtitle": "3rd Quarter Moon"
  },
  {
    "link": "/image_card/SolarSystem_Moon_AlpineValley.php",
    "thumb": "Images/moon_041004_200.jpg",
    "alt": "Alpine Valley",
    "title": "",
    "subtitle": "Alpine Valley"
  }
]